source,cos_sim,target,level
"Зато другому слуху он невольно верил и боялся его до кошмара: он слышал за верное, что Настасья Филипповна будто бы в высшей степени знает, что Ганя женится только на деньгах, что у Гани душа черная, алчная, нетерпеливая, завистливая и необъятно, непропорционально ни с чем самолюбивая; что Ганя хотя и действительно страстно добивался победы над Настасьей Филипповной прежде, но когда оба друга решились эксплуатировать эту страсть, начинавшуюся с обеих сторон, в свою пользу, и купить Ганю продажей ему Настасьи Филипповны в законные жены, то он возненавидел ее как свой кошмар. ",0.4200654141627579,"Тоцкий откуда-то узнал, что когда оба друга решились купить Ганю продажей ему Настасьи Филипповны в жёны, он возненавидел её. ",b1
"Если бы вы опять разошлись, то я был бы очень доволен; но расстраивать и разлаживать вас сам я не намерен. ",0.6567413422326943,"Если бы вы опять разошлись, то я был бы очень доволен; но ссорить вас я не хочу. ",b1
"Солдафон Соболев стал насмехаться: — Ох, Варвара Андреевна, вам, женщинам, только дай суфражировать, ведь одних красавчиков, дусек-пусек в парламент навыбираете. ",0.1647569804510494,"Сказали, что тогда мы, женщины, будем выбирать только красивых мужчин. ",b1
"Графиня Лидия Ивановна давно уже перестала быть влюбленною в мужа, но никогда с тех пор не переставала быть влюбленною в кого-нибудь. ",0.9108198161296492,"Графиня Лидия Ивановна давно уже перестала быть влюблённой в мужа, но никогда с тех пор не переставала быть влюблена в кого-нибудь. ",b1
"Но ему, я думаю, не будет большого горя уехать, а мне и моей жене его присутствие неприятно",1.0,"Но ему, я думаю, не будет большого горя уехать, а мне и моей жене его присутствие неприятно",b1
"Впрочем… простите меня, ваше сиятельство, — обратился управляющий к графу. — Простите, что я сделал сцену, но я просил бы ваше сиятельство запретить вашему Лепорелло, как вы изволили его назвать, распространять свое усердие на особ, достойных всякого уважения!",0.3155544535594917,"— вдруг сказал Урбенин и обратился к графу: — Простите, ваше сиятельство, но, пожалуйста, не разрешайте вашему слуге вообще говорить о порядочных людях. ",b1
Фандорин!»,0.2129082505552693,"Фандорина связали, закрыли ему рот и надели на него мешок. ",b1
Алексей не мог узнать свою Акулину в этой смешной и блестящей барышне. ,0.9059100296505614,Алексей не мог узнать свою Акулину в этой смешной барышне. ,a2
"— Но если Маклафлин не шпион, то куда же он делся? ",0.7594589955891422,"— Но если Маклафлин не шпион, то где он? ",b1
"Все эти дни по приезде в Петербург он собирался быть у нее; но, может быть, тайное предчувствие останавливало его. ",0.8206898885610519,Все эти дни по приезде в Петербург он собирался быть у неё; предчувствие останавливало его. ,b1
"В разговоре их всё было сказано; было сказано, что она любит его и что скажет отцу и матери, что завтра он приедет утром.",0.996224916732764,"В разговоре их всё было сказано; было сказано, что она любит его и что скажет отцу и матери, что завтра он приедет утром. ",b1
Германн глядел в щёлку: Лизавета Ивановна прошла мимо его. ,0.5674500404624203,"Германн видел, как Лизавета Ивановна прошла мимо кабинета. ",b1
"Не только в Петербурге у него не было ни одного человека, кому бы он мог высказать все, что испытывал, кто бы пожалел его не как высшего чиновника, не как члена общества, но просто как страдающего человека; но и нигде у него не было такого человека.",0.909831146346142,"Не только в Петербурге у него не было ни одного человека, кому бы он мог высказать всё, что испытывал, кто бы пожалел его не как высшего чиновника, но просто как человека; но и нигде у него не было такого человека. ",b1
"Как он это у меня спросил, я, уж не знаю отчего, покраснела, застыдилась, и опять мне стало обидно, видно оттого, что уж другие про это дело расспрашивать стали. ",0.8214219733999903,"Как он это у меня спросил, я, уж не знаю почему, покраснела, и опять мне стало обидно, видно потому, что уж другие про всё это дело расспрашивать стали. ",b1
"Усталый, голодный, счастливый, Левин в десятом часу утра, исходив верст тридцать, с девятнадцатью штуками красной дичи и одною уткой, которую он привязал за пояс, так как она уже не влезала в ягдташ, вернулся на квартиру. ",0.420569671621198,"На следующий день усталый, голодный, счастливый от удач ной охоты, Левин в десятом часу утра, исходив километров трид цать, вернулся в сарай. ",b1
"На другой день Алексей, твердый в своем намерении, рано утром поехал к Муромскому, дабы откровенно с ним объясниться. ",0.5370388530746985,"На другой день Алексей рано утром поехал к Му ром скому, чтобы поговорить с ним. ",a2
"Горек чужой хлеб, говорит Данте, и тяжелы ступени чужого крыльца, а кому и знать горечь зависимости, как не бедной воспитаннице знатной старухи? ",0.7899640291726279,"Горек чужой хлеб, говорит Данте, а кому и знать горечь зависимости, как не бедной воспитаннице? ",b1
На другой день вечером я опять был в графской усадьбе. ,0.3426784449431981,Через 15 минут он уже ехал на лошади по берегу огромного круглого озера к графской усадьбе. ,b1
На другой день вечером я опять был в графской усадьбе. ,0.5770735567785668,На другой день Сергей опять приехал в графскую усадьбу. ,b1
"В этот вечер она была так хороша, что я, пьяный, забыл всё на свете и сжал ее в своих объятиях… Она стала клясться мне, что никого никогда не любила, кроме меня… и это было справедливо: она любила меня… И, в самый разгар клятв, ей вздумалось вдруг сказать отвратительную фразу: «Как я несчастна! ",0.2948467190503692,"В этот вечер она была так красива, что я забыл всё на свете и обнял её. ",b1
"Он сказал, что ни на ком не женится, кроме вас, если только женится; вам же он оставил полную свободу хоть сейчас от него отказаться... ",1.0000000000000004,"Он сказал, что ни на ком не женится, кроме вас, если только женится; вам же он оставил полную свободу хоть сейчас от него отказаться... ",b1
"Ты поезжай туда, а я заеду, и вместе куда-нибудь обедать",0.9046424101559558,"Поезжай туда, а я заеду, и вместе куда-нибудь поедем обедать",b1
"Гуров, глядя на нее теперь, думал: «Каких только не бывает в жизни встреч!» ",0.811601365531614,Гуров смотрел на неё теперь и думал: «Каких только не бывает в жизни встреч!» ,b1
"- вскричала она вдруг, воспламеняясь необыкновенным гневом: - я не хочу, не хочу, чтобы там вечно заставляли меня краснеть. ",0.5216475125002545,"Я не хочу, чтобы там вечно заставляли меня краснеть, а потому и выбрала вас. ",b1
"Устал я, однако… Кирпичный завод… Это я не брежу, а в самом деле скоро поеду на кирпичный завод, начну работать… Уже был разговор. ",0.7606826006885504,"Это я не брежу, а в самом деле скоро поеду на кирпичный завод, начну работать... ",b2
"Отец уже собрался было ответить откровенно на вопрос сына, но, вспомнив, что долг отца быть строгим, дал Пете легонький подзатыльник и сказал: — Пошел спать, поросенок!",0.6568411424224505,"Отец уже собирался было ответить откровенно на вопрос сына, но, вспомнив, что долг отца быть строгим, сказал: Петя спать пошёл, но думать про рака не перестал. ",b1_c1
"— Конечно, был бы, — честно ответила Варя и спохватилась — это прозвучало как приглашение к флирту. — я хочу сказать, что у вас, Шарль, было бы шансов не меньше и не больше, чем у Михаила Дмитриевича. ",0.6131139330713372,"Был бы у меня — Да, — честно ответила Варя. — У вас было бы шансов не меньше и не больше, чем у Михаила Дмитриевича. ",b1
"* * * По Тверскому бульвару быстрыми, неверными шагами, не видя никого вокруг, шел щегольски одетый, но ужасно неряшливый молодой человек: мятый дорогой фрак, грязный белый галстук, в лацкане пыльная белая гвоздика. ",0.3474186504262736,"По Тверскому бульвару быстро шёл хорошо, но неаккуратно одетый молодой человек. ",b1
"А Жилин сам себя не помнит, плачет и приговаривает:  - Братцы! ",0.4529966091609462,"Казаки Жилина спрашивают: кто он, откуда, а Жилин только плачет и говорит: — Братцы! ",a2
"«Не знаю, я всегда так сижу».",0.5874171163382595,"— Не знаю, я всегда так сижу, на каждой станции",b1_c1
"Но, прежде чем он успел это сделать, Долохов, глядя прямо в лицо Ростову, медленно и с расстановкой, так, что все могли слышать, сказал ему: — А помнишь, мы говорили с тобой про игру… дурак, кто на счастье хочет играть; играть надо наверное, а я хочу попробовать.",0.9286101934263848,"Но, прежде чем он успел это сделать, Долохов, глядя прямо в лицо Ростову, медленно, так, что все могли слышать, сказал ему: — А помнишь, мы говорили с тобой про игру... дурак, кто на счастье хочет играть; играть надо наверное, а я хочу попробовать. ",b1_c1
"Кстати: я чай, она уж очень постарела, княгиня Дарья Петровна?",0.6790529777097581,"Кстати, наверное, она уж очень постарела, Дарья Петровна?",b1
Скрип тихих шагов на песке аллеи заставил его поднять голову. ,0.8184459403323545,Звук тихих шагов на песке аллеи заставил его поднять голову. ,b1
"И, сказав эти слова, она взглянула на сестру и, увидев, что Долли молчит, грустно опустив голову, Кити, вместо того чтобы выйти из комнаты, как намеревалась, села у двери и, закрыв лицо платком, опустила голову. ",0.8172612518297172,"Сказав эти слова, Кити взглянула на сестру, но, увидев, что Долли молчит, вместо того чтобы выйти из комнаты, как хотела, села у двери и, закрыв лицо, тоже опустила голову. ",b1
После этого можно забирать свои вещи и уходить. ,0.557903002416941,После этого она может взять свои вещи и уйти. ,b1
"Возле меня сидело существо, единственно порядочное и достойное уважения… Двух только людей знал я в нашем уезде, которых я в силах был любить и уважать, которые одни только имели право отвернуться от меня, потому что стояли выше меня… Это были Надежда Калинина и доктор Павел Иванович… Что ожидало их?",0.3697543570399593,Это были Надежда Калинина и доктор Павел Иванович Вознесенский,b1
"Если хочешь разговаривать, то отдай колясочку с ребенком кому-нибудь другому. ",0.9378121858204316,"Если хочешь разговаривать, то отдай колясочку с ребёнком кому-нибудь другому. ",b2
"Год тому назад вы вдруг, ни с того ни с сего, внезапно прекращаете свои визиты. ",0.3348558096059031,И вдруг… Вдруг вы прекратили свои визиты! ,b1
"— Видимо, подполковник Казанзаки, — сказала Варя, и все обернулись к ней.",0.4320463770159748,"— Надо спросить у Казанзаки, — сказала Варя, и все посмот рели на неё. ",b1
"Не может он меня ненавидеть, и не мог он так сказать! ",0.9732835467204304,"— Не может он меня ненавидеть, и не мог он так сказать! ",b1
"Обыкновенно ведь горюющим людям не до разговоров, а вы мало того, что длинно разговариваете, но еще и высказываете мелочное неудовольствие. ",0.2582840641366871,А сегодня вы даже веселы и охотно разговариваете. ,b1
Вы к нам батарейным командиром?,0.8487597655622641,Вы к нам ба та рейным командиром?,b2
"Стал Жилин вспоминать, когда он в крепости дома жил, где солнце всходило и где заходило. ",0.3138714332761443,"Ходил Жилин на гору, внимательно смотрел, в какую сторону им бежать, где дороги, где лес, где аулы. ",a2
"Слава богу, Казанзаки наконец оставил человека в покое. ",0.3818415721564354,"«Слава Богу, — подумала она, — что Казанзаки его освободил. ",b1
"Выйдя из Тенева, я пошел той же дорогой, что шел и утром. ",0.508441099054776,"Часть 11  Сергей вышел из Тенева и пошёл по той же дороге, что и утром. ",b1
"Титулярный советник застегнул ворот, ответил серьезно: — Если живешь в г-государстве, надобно либо его беречь, либо уж уезжать — иначе получается паразитизм и лакейские пересуды",0.3030910306452434,"Фандорин встал и серьёзно ответил: — Если живёшь в государстве, надо его защищать. ",b1
"Дважды чуть не дошло до кровопролития, и оба раза, как на грех, из-за Вари.",0.2476212300217521,Два из них чуть не закончились дуэлями (всё из-за Вари!). ,b1
"Германн слышал, как хлопнула дверь в сенях, и увидел, что кто-то опять поглядел к нему в окошко.",0.6964588046047516,"Германн слышал, как закрылась дверь, и увидел, что кто-то опять посмотрел к нему в окошко.",b1
Для любви одной природа нас на свет произвела! ,1.0000000000000002,Для любви одной природа нас на свет произвела! ,b2
"— О, благодарю вас, — закричал я, — вы не знаете, что вы для меня теперь сделали! ",0.786334230455943,"— О, благодарю вас, — закричал я, — вы не знаете, что вы для меня теперь сделали!",b1
"Если один из вас и вправду убьет другого, будет ему за смелость награда, сами знаете, какая». ",0.2591836920918008,"«Хорошо, — говорит она, — если один из вас убьёт другого, буду его любить». ",b1
«И как же я могу вернуться на землю? ,0.8880042097389997,«И как же я могу вернуться на землю? ,b1_c1
"Как хороши, как свежи были розы… А в комнате всё темней да темней… Нагоревшая свеча трещит, беглые тени колеблются на низком потолке, мороз скрыпит и злится за стеною — и чудится скучный, старческий шёпот… Как хороши, как свежи были розы… Встают передо мною другие образы… Слышится веселый шум семейной деревенской жизни. ",0.5276449211587559,"Свеча трещит, тени колеблются на низком потолке, мороз скрипит за стеною — и чудится скучный, старческий шёпот... ",b1_c1
"Дверь, противненько скрипнув, поползла створкой внутрь, и на пороге возникло диковинное видение: маленький щуплый господин неопределенного возраста с бритым, круглым личиком и узкими, в лучиках мелких морщин глазами.",0.3750745267779481,"Дверь открылась, и в комнату вошёл незнакомый маленький господин неопределённого возраста с круглым лицом и узкими глазами",b1
"Она хочет видеть вас счастливым; она уверена, что только я составлю ваше счастие… Она так дико пишет… странно… Я никому не показала писем, я вас ждала; вы знаете, что это значит? ",0.5825697553216089,"Я никому не показала писем, я вас ждала; вы знаете, что это значит?",b1
"Николай сказал, что ему и это слишком много и что он дает честное слово не брать больше денег до весны. ",0.9407741327296067,"Николай сказал, что ему и это слишком много и что он даёт честное слово не брать больше денег до весны. ",b1_c1
"Бал только что начался, когда Кити с матерью входила на большую, уставленную цветами и лакеями в пудре и красных кафтанах, залитую светом лестницу. ",0.4833591851964171,"XXII Бал только начался, когда Кити с матерью входила на лестницу. ",b1
"За сценой бьют в набат по случаю пожара, начавшегося уже давно. ",0.8259922457047967,"Третий час бьют в набат по случаю пожара, начавшегося уже давно. ",b2
"Она была больна, и с приближением весны здоровье ее становилось хуже. ",0.9571579977042411,"Она была больна, и с приближением весны здоровье её становилось хуже. ",b1
"Затем сын черноморского героя мягко, без нажима перешел к делу. ",0.6776562406429399,Затем сын героя мягко перешёл к делу. ,b1_c1
"Кити не видала его с того вечера, когда она отказала Левину. ",0.9380270288208896,"Кити не видела его с того вечера, когда отказала Левину. ",b1
"Хотя он и ездил изредка в петербургский свет, все любовные интересы его были вне света.",0.9976815893106156,"Хотя он и ездил изредка в петербургский свет, все любовные интересы его были вне света. ",b1
"– возразил Германн, – бьёте вы мою карту или нет? ",0.7373207559511603,"— сказал Германн, — бьёте вы мою карту или нет?",b1
Он прикрывает дорогу на Софию.,0.3556975968483993,"Если этот город будет наш, то дорога на Софию для нас будет открыта",b1
