source,cos_sim,target,level
Или дитя ваше спросит вас: «Что ждет меня в загробной жизни?» ,0.7843983085356666,Или ребёнок спросит вас: «Что ждёт меня в загробной жизни?» ,b1
"Но он уже пригляделся, так что мог различать всю постель; на ней кто-то спал, совершенно неподвижным сном; не слышно было ни малейшего шелеста, ни малейшего дыхания. ",0.8012710498672203,"Он уже мог различать всю кро-вать; на ней кто-то спал, совершенно неподвижным сном; не слышно было ни малейшего дыхания. ",b1
"Свобода, свободный ум и наука заведут их в такие дебри и поставят пред такими чудами и неразрешимыми тайнами, что одни из них, непокорные и свирепые, истребят себя самих, другие, непокорные, но малосильные, истребят друг друга, а третьи, оставшиеся, слабосильные и несчастные, приползут к ногам нашим и возопиют к нам: „Да, вы были правы, вы одни владели тайной его, и мы возвращаемся к вам, спасите нас от себя самих“. ",0.8294971511823072,"Свобода, свободный ум и наука заведут их в такие дебри и поставят пред такими чудами и неразрешимыми тайнами, что одни из них истребят себя самих, другие истребят друг друга, а третьи, оставшиеся, слабосильные и несчастные, приползут к ногам нашим и возопиют к нам: «Да, вы были правы, спасите нас от себя самих». ",b1_c1
К третьему и окончательному штурму плевненской твердыни готовились весь знойный август. ,0.4877370971098205,"— Всё проще, — Варя улыбнулась ему как ребёнку и пошла К третьему штурму Плевны готовились весь август. ",b1
"Стройный, высокий, румянец во всю щеку",0.719817637741131,"Стройный, высокий, румянец во всю щёку… — Правда? ",a2
"Пожить и пожить… Любопытство меня жгло… вы этого не понимаете, но, клянусь богом, я уже не могла владеть собой, со мной что-то делалось, меня нельзя было удержать, я сказала мужу, что больна, и поехала сюда… И здесь все ходила, как в угаре, как безумная… и вот я стала пошлой, дрянной женщиной, которую всякий может презирать.",0.3105514381235262,"И здесь всё ходила, как ненормальная... и вот я стала низкой женщиной, которую никто не будет уважать.",b1
К Ганецкому не поспеть. ,0.262021940501592,Среди солдат и офицеров Ганецкого в живых почти никого не осталось. ,b1
"Хозяин думал, что лев забудет своё горе, если ему дать другую собачку, и пустил к нему в клетку живую собачку; но лев тотчас разорвал её на куски. ",0.31641332270092,Хозяин зверинца дал льву другую живую собаку. ,a2_b1
Во главу изучения природы Ломоносов ставил опыт — это его характерная черта как ученого. ,0.8768833400941292,"Во главу изучения природы Ломоносов ставил опыт, это его характерная черта как учёного. ",b1_c1
"Мы вот и любим тоже по-розну, во всем, то-есть, разница, - продолжал он тихо и помолчав. - Ты вот жалостью, говоришь, ее любишь. ",0.4049463243253733,Мы вот и любим тоже по-разному. ,b1
"Мне б-было ясно, что его там нет и быть не может",0.6310336974117797,"Мне было понятно, что его там нет и быть не может",b1
"Правду ли говорил немец, или только желал похвастаться дальновидностию, но он ни мало тем не утешил бедного больного. ",0.6848884116110053,"Правду ли говорил немец или нет, но он не утешил бедного больного. ",a2
"С усами я или без усов, а я одинаково доволен. ",0.9421511044618076,"С усами я или без усов, а я одинаково доволен... ",b2
Перед отъездом Варя пообещала ему две вещи: что скоро даст окончательный ответ и что воевать они будут непременно вместе — уж она что-нибудь придумает.,0.1370552588262023,"Перед тем как что-то сказать, Варя посмотрела в окно и увидела... башню мечети! ",b1
"— Так-с… Ваша повесть мне нравится: она лучше и интереснее очень многих уголовных романов… Только нам с вами, по взаимному соглашению, придется произвести в ней кое-какие весьма существенные изменения… — Это можно. ",0.3601716556824796,"— Ваша повесть мне нравится, она лучше других криминальных романов. ",b1
"— Как и любому правоверному, четыре. ",0.2199267376153909,— Как и всем остальным восточным мужчинам — четырёх. ,b1
"И смешно: мы всегда были люди среднего круга, самого среднего, какого только можно быть; зачем же лезть в тот великосветский круг? ",0.7405990301782073,Мы всегда были люди среднего круга; зачем же лезть в великосветский круг?,b1
"— сердилась бабушка, — да скоро ли этот зеришка проклятый выйдет? ",0.9231403616452304,— сердилась бабушка. — Да скоро ли этот зеришка проклятый выйдет? ,b1_c1
"Я коротко их знаю; я почти изучил их физиономии — и любуюсь на них, когда они веселы, и хандрю, когда они затуманятся. ",0.4793777908739647,"Я хорошо их знаю; я почти изучил их лица — я рад, когда они веселы, мне грустно, когда они печальные. ",b1
А мы с госпожой Суворовой едем кататься. ,0.3224988780666394,"— Лукан важ но посмотрел на всех, встал и добавил: — А мы с мадемуазель Суворовой едем смотреть ночной Бухарест. ",b1
"И в голове Алексея Александровича сложилось ясно всё, что он теперь скажет жене. ",1.0,"И в голове Алексея Александровича сложилось ясно всё, что он теперь скажет жене. ",b1
"Ей так страшно теперь было оставаться одной, что, не дожидаясь прихода человека, она пошла навстречу ему",0.90516449920075,"Ей так страшно теперь было оставаться одной, что, не дожидаясь прихода слуги, она пошла навстречу ему",b1
Потом он обнял своими лапами мёртвую собачку и так лежал пять дней.,0.5074345981990602,Потом он лёг около мёртвой собаки и лежал пять дней.,a2_b1
"Минуты две, опустив голову с выражением напряженного усилия мысли, стоял он с револьвером в руках неподвижно и думал. ",0.6649472182533409,"Минуты две, опустив голову, стоял он с револьвером в руках неподвижно и думал, потом приложил револьвер к левой стороне груди. ",b1
"– Не думаю, – отвечал важно Томский",0.5335766392743018,"— добавил третий. — Не думаю, — отвечал важно Томский. — Как! ",b1
— Не Урбенин!,0.2910831317078372,"После Урбенина Сергей зашёл в камеру к Кузьме. — Ну что, будешь говорить? ",b1
"Эта новая женщина, оказалось, во-первых, необыкновенно много знала и понимала, - так много, что надо было глубоко удивляться, откуда могла она приобрести такие сведения, выработать в себе такие точные понятия. ",0.5751300786885506,"Эта новая женщина, во-первых, необыкновенно много знала и понимала. ",b1
"Мне казалось, что он всю жизнь просился из души моей, и только теперь",0.7751419732627409,"Мне казалось, что он всю жизнь был в душе моей, и только теперь",b1
Они остались вдвоем.,0.4268410657607975,"Д’Эвре закрыл дверь, и они остались вдвоём... ",b1
"И Долли видела, что слезы выступили ей на глаза. ",0.4513475664671115,"И Долли видела, что слёзы появились у неё на глазах. — Что эти дома? ",b1
"— Хорошо, оставим до будущего раза… Теперь только скажите мне: правда ли, что вы били вашу жену? ",0.576094582659125,"Только скажите мне: правда ли, что вы били свою жену? ",b1
Анна была хозяйкой только по ведению разговора. ,0.9999999999999998,Анна была хозяйкой только по ведению разговора. ,b1
"Заметят по лицу, что вы без паспорта, и сейчас: кто таков? ",1.0000000000000004,"Заметят по лицу, что вы без паспорта, и сейчас: кто таков? ",b1_c1
"— Благодарю вас, — сухо ответила она. — Очень благородно. ",0.4142751928733718,"Вам не обязательно быть моим секре — Благодарю вас, — холодно ответила Варя. — Вы знали, что я была в кабинете. ",b1
"Я тотчас же вскочила, вся, не знаю отчего, покраснела, да и позабыла, что сижу пришпиленная; нет, чтоб тихонько отшпилить, чтобы жилец не видал, — рванулась так, что бабушкино кресло поехало. ",0.606033970684693,"Я тотчас же встала, вся, не знаю почему, покраснела, да и забыла, что сижу пристёгнутая, нет, чтоб тихонько отстегнуть, чтоб жилец не видел, — встала так, что бабушкино кресло поехало.",b1
"Ну, рассказывайте",0.2452811635312791,"Он начал одеваться и рассказывать доктору Вознесенскому, где был. ",b1
"Это вам на память… книжка с карандашиком… Мы здесь пойдем к реке… Отходят, оба оглядываются.",0.5045882120958735,Это вам на память... книжка с карандашиком... ,b2
"Она не плакала, но была грустна, точно больна, и лицо у нее дрожало",0.8278599174278135,"Она не плакала, но была грустна, как будто больна, и лицо у неё дрожало",b1
"Наш Анвар в это время благочестиво молился в мечети, чему есть многочисленные свидетели.",0.4000903531209787,...Анвар в это время был в мечети. ,b1
"Ну, да тогда и досталось мне: тотчас меня опять посадили на место и уж ни-ни, шевельнуться было нельзя. ",0.6667816674032763,"Ну, тогда тотчас меня опять посадили на место и уж нини, уйти было нельзя. ",b1
"Государственный канцлер князь Корчаков собственной персоной — точно такой же, как на портретах, разве только посубтильней. ",0.2569746896846849,"В кабинете государя было двое: государь и князь Корчаков, министр иностранных дел России. ",b1
"Мне кажется, никто еще не описал верно любви, и едва ли можно описать это нежное, радостное, мучительное чувство, и кто испытал его хоть раз, тот не станет передавать его на словах. ",0.7494809278231617,"Мне кажется, никто ещё не описал верно любовь, и можно ли описать это нежное, радостное, мучительное чувство, и кто хоть раз любил, тот не будет передавать это чувство словами. ",b1
"И Старцев избегал разговоров, а только закусывал и играл в винт, и когда заставал в каком-нибудь доме семейный праздник и его приглашали откушать, то он садился и ел молча, глядя в тарелку; и всё, что в это время говорили, было неинтересно, несправедливо, глупо, он чувствовал раздражение, волновался, но молчал, и за то, что он всегда сурово молчал и глядел в тарелку, его прозвали в городе «поляк надутый», хотя он никогда поляком не был.",0.4323521218641412,"Когда он оказывался на семейном празднике и его приглашали за стол, он садился, смотрел в тарелку, ел и молчал. ",b1
"Весь бал до последней кадрили был для Кити волшебным сновидением радостных цветов, звуков и движений. ",1.0000000000000004,"Весь бал до последней кадрили был для Кити волшебным сновидением радостных цветов, звуков и движений. ",b1
"Приходи ко мне, князь. ",0.28457877063779,"Да чуть ли ещё не ругала вас, князь. ",b1
" - Позвольте вам заметить,- сказал он,- вы говорите о китайской промышленности и сравниваете ее с европейскою. ",0.8026632166813763,"— Позвольте вам заметить, — сказал он, вы говорите о китайской промышленности и сравниваете её с европейской. ",b1_c1
– говорили игроки. – Чекалинский снова стасовал карты: игра пошла своим чередом.,0.3759423729543998,Чекалинскийснова взял карты в руки: игра продолжилась.,b1
"- Для знакомств вообще я мало времени имею, - сказал генерал, - но так как вы, конечно, имеете свою цель, то… - Я так и предчувствовал, - перебил князь, - что вы непременно увидите в посещении моем какую-нибудь особенную цель. ",0.6496569996740073,"— Я так и предчувствовал, — перебил князь, — что вы непременно увидите в посещении моём какую-нибудь особенную цель. ",b1
"— Так как же вы жили, коль нет истории? ",0.6705721823500179,"— Так как же вы жили, если нет истории? ",b1
"Потом Лука скок вперед и делает клинком этакий скрипичный ключ на фоне атмосферы, а Эвре, не трогаясь с места, только подался туловищем назад, ушел от удара и молниеносно, я и не заметил как, чиркнул сабелькой — прямо румыну по горлу, самым острием. ",0.1429411815249983,Неожиданно Лукан прыгает вперёд и делает саблей хитрое движение. ,b1
"Позвольте, наконец, узнать от вас самого и лично: сватаетесь вы за меня или нет?",0.4788204411986054,— Можно узнать от вас лично: женитесь вы на мне или нет? ,b1
"Вронский был везде, где только мог встречать Анну, и говорил ей, когда мог, о своей любви. ",0.9999999999999994,"Вронский был везде, где только мог встречать Анну, и говорил ей, когда мог, о своей любви. ",b1
"Оставшись один на перекрестке, князь осмотрелся кругом, быстро перешел через улицу, близко подошел к освещенному окну одной дачи, развернул маленькую бумажку, которую крепко сжимал в правой руке во все время разговора с Иваном Федоровичем, и прочел, ловя слабый луч света: ""Завтра в семь часов утра я буду на зеленой скамейке, в парке, и буду вас ждать. ",0.4213352203535982,"Аглая ушла, и князь прочитал: «Завтра в семь часов утра я буду на зелёной скамейке, в парке, и буду вас ждать. ",b1
Совершенно другая особа была сестрица Гаврилы Ардалионовича. ,1.0,Совершенно другая особа была сестрица Гаврилы Ардалионовича. ,b1
"Но однажды произошел у них наедине некий разговор, который Варя впоследствии восстановила по памяти и слово в слово записала в дневнике (после отъезда Эраста Петровича почему-то потянуло писать дневник — должно быть, от безделья).",0.2237301957934884,Но вот однажды между ними произошёл разговор... ,b1
"Это еще дедовский дом, и он ничего не изменен снаружи",0.5058409428880783,"Это ещё дедовский дом, и он не изменён с внешней стороны",b1
"Он сделал все возможное, чтобы отношения между Портой и Россией были разорваны. ",0.3881001648715523,"Он всё сделал, чтобы меж ду Турцией и Россией не было дипломатических отноше ний. ",b1
"– Очень жалко, что я именно не могу между половиной седьмого и девятью, – сказала она, чуть улыбаясь",0.7578044077220057,"— Очень жалко, что я не могу между половиной седьмого и девятью, — сказала она",b1
"Да, ничего себе, только жена, теща и две девочки. ",0.6912037493313001,"Да, ничего себе, только жена, тёща и две девоч ки. ",b2
"Если бы вы пожили больше с людьми, а в свете, я надеюсь, вам будут рады, как замечательному молодому человеку, то, конечно, успокоите ваше одушевление и увидите, что все это гораздо проще… и к тому же такие редкие случаи… происходят, по моему взгляду, отчасти от нашего пресыщения, а отчасти от… скуки… - Именно, именно так, - вскричал князь, - великолепнейшая мысль! ",0.3096860205097238,К тому же такие редкие случаи... происходят отчасти от... скуки...,b1
"Позавтракав, он тотчас же лег на диван, и в пять минут воспоминания безобразных сцен, виденных им в последние дни, перепутались и связались с представлением об Анне и мужике-обкладчике, который играл важную роль на медвежьей охоте; и Вронский заснул. ",0.2913350968683271,"Позавтракав, он лёг на диван и заснул. ",b1
"А генерал Соболев, как видите, и после моих пространных объяснений все еще не убежден.",0.1953151618003515,"Дверь кабинета открылась, и все увидели офицера, убежавшего выполнять приказ Соболева. ",b1
"Стало быть, Ольга еще не умерла. ",0.3373949267174376,"Её глаза были закрыты, но она ещё не умерла. ",b1
"Вот поди ж ты — дикая, азиатская страна, а при парламенте, не то что Россия.",0.4947499977552857,"Все удивлялись, что в России парламента нет, а в азиатской стране есть. ",b1
"Вы думаете, во мне говорит только мать, но нет, нет, уверяю вас! ",0.9999999999999996,"Вы думаете, во мне говорит только мать, но нет, нет, уверяю вас! ",b2
Через неделю я ему опять попалась на лестнице. ,0.6937146689330735,Через неделю мы опять встретились на лестнице. ,b1
"Но тут Фандорин с не свойственной ему в обычных обстоятельствах бесцеремонностью вылез вперед, не дал договорить: — Скажите, генерал, был ли у вас п-перед самым штурмом корреспондент газеты «Дейли пост» Маклафлин?",0.4621325626844639,"— Скажите, генерал, не был ли у вас перед самым штурмом журналист Маклафлин? ",b1
"Через час выходит ко мне такая сумрачная: ""Я, говорит, пойду за тебя, Парфен Семенович, и не потому что боюсь тебя, а все равно погибать-то. ",0.7008807940208139,"Через час выходит ко мне, мрачная: — Я, говорит, пойду за тебя, Парфён Семёнович, всё равно погибать-то. ",b1
