source,cos_sim,target,level
"Не так, как бы я хотела любить, но я его люблю, а Анна не любила своего? ",0.9579543221313372,"Не так, как бы я хотела любить, но я его люблю, а Анна не любила своего. ",b1
"Я даже не думал, что у нас так холодно. ",0.9596660316863423,"— Я даже не думал, что у нас так холодно. ",b1
"На второе был такой же ответ, как и на первое… Очевидно, милый «щур» делал вид, что сердится… Бедняга, получив отказ от Наденьки Калининой, причиной своего несчастья считал меня. ",0.2315121190542113,"Он знал, что бедный Вознесенский получил отказ от Наденьки и думал, что виноват Сергей. ",b1
"Выкормлю жеребят, продам; куплю дом и заведу огород. ",0.3332694073942563,"Если я продам жеребят, то я смогу купить дом. ",a2_b1
"Ты не сошел с креста, когда кричали тебе, издеваясь и дразня тебя: „Сойди со креста и уверуем, что это ты“. ",0.742770634638038,"Ты не сошёл с креста, когда кричали тебе, издеваясь и дразня тебя: «Сойди с креста и уверуем, что это ты». ",b1_c1
"— Какой там мертв, петли толком затянуть не умеют, — гаркнул тот. — Вынули Яблокова, откачивают!",0.1961196146551509,Даже убить себя как надо не умеют! ,b1
"Комната эта была не та парадная, которую предлагал Вронский, а такая, за которую Анна сказала, что Долли извинит ее. ",0.699548880367093,"Комната для Долли была не та комната для гостей, которую предлагал Вронский, а та, за которую Анна попросила извинить её. ",b1
— сказал Урбенин,0.4385511048974249,Урбенин на допросе не сказал ничего нового,b1
"Я принимал все за чистую монету; я думал, что она... ",0.8374573278110695,"А я... я принимал всё за чистую монету; я думал, что она... ",b1
"— Это дурно, что вы говорите, и я прошу вас, если вы хороший человек, забудьте, что вы сказали, как и я забуду, — сказала она наконец",0.9316194403578664,"— Это плохо, что вы говорите, и я прошу вас, если вы хороший человек, забудьте, что вы сказали, как и я забуду, — сказала она наконец",b1
"Я просто не знаю, что бы делала, если б вас не встретила",0.169454439985641,"— Да, вам будет не больно, если с него упадёте. ",b1
"– Он не кусается, – сказала она и покраснела",0.4679714184569482,"Дама посмотрела на него и сразу же отвела глаза. — Она не кусается, — сказала она и покраснела. — Можно дать ей что-нибудь? ",b1
"Значение науки как могучей силы, направляющей рост культуры страны по правильному пути, Бэкон дает в следующем красивом образе, где наука противопоставляется эмпиризму: «...хромой калека, идущий по верной дороге, может обог-нать рысака, если тот бежит по неправильному пути. ",0.6267038591792654,"Бэкон даёт следующий красивый образ, где наука противопоставляется эмпиризму: «Хромой человек, идущий по верной дороге, может обог-нать быструю лошадь, если та бежит по неправильному пути. ",b1_c1
"— Увидите... только я не знаю, как уж я доживу хотя сутки",0.6893846736367075,"— Увидите... только я не знаю, как уж я доживу до завтра",b1
"Что же касается особых примет, то их не было. ",1.0,"Что же касается особых примет, то их не было. ",b1_c1
"Предатель Митко завел спутницу в корчму, более всего похожую на разбойничий притон, усадил за стол, велел подать сыру и кувшин вина, а сам повернул к двери, показав, мол, сейчас приду. ",0.160690116819531,В трактире проводник посадил её за стол и приказал принести вина и сыра. ,b1
"Скажи, что я… И в тот самый момент, когда с моего языка готово уже было сорваться решительное «нет», мною вдруг овладело тяжелое чувство… Молодой человек, полный жизни, сил и желаний, заброшенный волею судеб в деревенские дебри, был охвачен чувством тоски, одиночества… Вспомнился мне графский сад с роскошью его прохладных оранжерей и полумраком узких, заброшенных аллей… Эти аллеи, защищенные от солнца сводом из зеленых, сплетающихся ветвей старушек-лип, знают меня… Знают они и женщин, которые искали моей любви и полумрака… Вспомнилась мне роскошная гостиная, с сладкою ленью ее бархатных диванов, тяжелых портьер и ковров, мягких, как пух, с ленью, которую так любят молодые, здоровые животные… Пришла мне на память моя пьяная удаль, не знающая границ в своей шири, сатанинской гордости и презрении к жизни. ",0.2854764320479651,"Он вспомнил прекрасный графский сад, прохладные оранжереи, роскошные комнаты его дома… И женщин, которые почти всегда бывали в этом доме и хотели его любви",b1
"Она была должна опуститься до действительности, чтобы наслаждаться им таким, каков он был. ",0.794052770555318,"Она должна была опуститься до действительности, чтобы он нравился ей таким, каков он был. ",b1
Кити не было на постели подле него. ,0.6775720571447913,Кити не было в постели около него. ,b1
"Варя купила широкие штаны вроде шальвар, рубаху, сапоги, куртку без рукавов и дурацкую суконную шапку, переоделась и разом превратилась из европейской барышни в худенького болгарского подростка. ",0.2349782672163345,"Чтобы этого не случилось, Варя, как девушка умная, первым делом купила себе болгарскую мужскую одежду и шапку. ",b1
"Она смутно решила себе в числе тех планов, которые приходили ей в голову, и то, что после того, что произойдет там на станции или в именье графини, она поедет по Нижегородской дороге до первого города и останется там.",0.7923408381703771,"Она решила себе, что после того, что произойдёт там на станции или в имении графини, она поедет по Нижегородской дороге до первого города и останется там. ",b1
"Так же и вы не будете замечать Москвы, когда будете жить в ней. ",1.0000000000000002,"Так же и вы не будете замечать Москвы, когда будете жить в ней. ",b2
"Позвольте мне в сей радостный день высказать перед вами всё, что накопилось тут, в груди, под сводами моего душевного здания… Пред вами старец, убеленный сединами, стоящий одною ногою в могиле… Я… я плачу. ",0.0985387306049874,"Ваши знания, энергия и присущий вам такт были причиною необычайного успеха и редкого процветания. ",a2_b1
"Но в последнее время явились новые, внутренние отношения между ним и ею, пугавшие Вронского своею неопределенностью. ",0.8331092081471863,"Но в последнее время появились новые, внутренние отноше ния между ним и ней, пугавшие Вронского своей неопределённостью. ",b1
"Пошлем запрос англичанам по дипломатическим каналам, попросим задержать эту мисс Ольсен до выяснения, да и дело с концом",0.3559609673038368,Через наших дипломатов узнаем у англичан об этой мисс Ольсен,b1
"Перейдя Неву, воспитанники Академии художеств учились у Рембрандта и Веласкеса, у «малых голландцев», которые так повлияли на будущих передвижников… Русская культура благодаря совмещению в ней различных наследий полна внутренней свободы. ",0.5552496989499438,Русская культура благодаря совмещению в ней различных наследий полна внутренней свободы. ,b1_c1
"Таким образом, в течение всей университетской жизни (в течение 4 лет), если университет действительно удовлетворяет своему назначению, т. е. если в нем преподают свободную науку и преподают ее студентам, которые способны воспринять эту науку, то, изучая предметы одной категории, студенты в то же время находятся в сфере наук всех категорий, которыми в данный момент обладает человечество. ",0.9553340455342744,"Таким образом, в течение всей университетской жизни (в течение 4 лет), если уни вер ситет действительно удовлетворяет своему назначению, то есть если в нём преподают свободную науку и преподают её студентам, которые способны воспринять эту науку, то, изучая предметы одной категории, студенты в то же время находятся в сфере наук всех категорий, которыми в данный момент обладает человечество. ",b1_c1
"Сверхнационализм, универсализм – такое же существенное свойство русского национального духа, как и безгосударственность, анархизм. ",0.9622660255810956,"Сверхнационализм, универсализм — такое же существенное свойство русского национального духа, как и безгосударственность, анархизм. ",b1_c1
"О приезде его я уже знаю; но вот уже третий день нет ни письма, ни его. ",0.9999999999999998,"О приезде его я уже знаю; но вот уже третий день нет ни письма, ни его. ",b1
Итальянцы пошептались и спросили робко: — А с какою целью вы все это делаете?,0.8964615167442895,Итальянцы пошептались и спросили робко: — А с какой целью вы всё это делаете? ,b1_c1
Связь эта утвердилась еще больше во время студенчества Левина. ,0.7824561203288355,Связь эта укрепилась ещё больше во время студенчества Левина. ,b1
"Но ошибка, сделанная им, произошла не оттого только, что он не обдумал этой случайности, а оттого тоже, что он до этого дня свидания с умирающею женой не знал своего сердца. ",0.8301028185519128,"Но ошибка, сделанная им, произошла не потому только, что он не обдумал этой случайности, а потому тоже, что он до свидания с умирающей женой не знал своего сердца. ",b1
"Поскольку д’Эвре казался расслабленным, как никогда, Варя задала вопрос, давно ее интересовавший: — Шарль, а есть ли у вас семья?",0.4776362269365221,"Посмотрев на д’Эвре, она спросила о том, о чём давно хотела спросить: — Шарль, а есть ли у вас семья? ",b1
"Но даже и в игре неприятным казалось терять высоту; и решительно взмыл он вверх, перестал кружиться, громосвистящей ракетой понесся прямо ввысь, к своей высокой последней цели. ",0.6715797460910921,"Но даже и в игре казалось неприятным терять высоту; и решительно направил он машину вверх, к своей высокой последней цели. ",b1_c1
"Что ни день переезды, новые города, умопромрачительные горные пейзажи и бесконечные торжества по поводу чуть ли не ежедневных викторий. ",0.2131319961695785,"Она видела новые города, бывала в горах. ",b1
"И таков всякий из них; а эти ведь, о которых Евгений Павлыч заговорил, не хотят себя даже считать преступниками и думают про себя, что право имели и… даже хорошо поступили, то-есть почти ведь так. ",0.53118597523461,"А новые молодые люди не хотят себя считать преступниками и думают про себя, что право имели и... даже хорошо поступили. ",b1
"Наконец оно выпало у меня из рук, и я закрыл лицо",0.9999999999999998,"Наконец оно выпало у меня из рук, и я закрыл лицо",b1
"А семья… Только отец, которого я горячо люблю и по которому очень скучаю. ",0.86576020794538,"Только отец, которого я горячо люблю и по которому очень скучаю. ",b1
"- На мне, - проговорил Рогожин",0.5486864031965797,"— На мне, — проговорил Рогожин. — Ну, и пойдём. ",b1
"Он почувствовал себя «дома» в каюте, без «снасти» удовлетворенно довольным и, развалившись с протянутыми ногами в большом плетеном кресле у стола, с наслаждением затягивался из трубки крепким и вкусным сухумским табаком по рублю за око , и по временам насмешливая улыбка светилась в его маленьких острых глазах.",0.2295037687505258,Он вдохнул из трубки крепкий и вкусный табак по рублю за фунт и продолжил: — Был сегодня на обеде у князя Собакина… Да-а… Большая персона приехала в наш Севастополь. ,b1_c1
"«А приданого они дадут, должно быть, немало», — думал Старцев, рассеянно слушая.",0.7418167522314907,"«А приданого они дадут, должно быть, немало», — думал Старцев и слушал его невнимательно.",b1
"Потом они нашли подле дороги щавель, пошли собирать его и забыли про котёнка.",0.5309453739311351,"Потом они нашли около дороги  ягоды, начали собирать их и забыли о котёнке.",a2_b1
В управляющие к графу поступил он шесть лет тому назад. ,0.2625025430121444,И вдруг к графу приехала его жена! ,b1
"Манилова проговорила, несколько даже картавя, что он очень обрадовал их своим приездом и что муж ее не проходило дня, чтобы не вспоминал о нем",0.8222807256183017,"Манилова проговорила, что он очень обрадовал их своим приездом и что муж её, не проходило дня, чтобы не вспоминал о нём",b1_c1
"На пожаре я загрязнился весь, ни на что не похож.",0.9999999999999996,"На пожаре я загрязнился весь, ни на что не похож.",b2
"Ростов в десятом часу, из театра, где он был вместе с своими и Денисовым, приехал в назначенный день в Английскую гостиницу. ",0.9999999999999998,"Ростов в десятом часу, из театра, где он был вместе с своими и Денисовым, приехал в назначенный день в Английскую гостиницу. ",b1_c1
"А здесь какая широкая, какая богатая река! ",1.0000000000000002,"А здесь какая широкая, какая богатая река! ",b2
"А теперь уж не то, к сожалению.",1.0000000000000002,"А теперь уж не то, к сожалению.",b2
"Как ни смотри – глупо, глупо… И зачем она ставит меня в такое положение?» ",0.8789571598863454,Как ни смотри — глупо… И зачем она ставит меня в такое положение?» ,b1
"— спросил Перепелкин и виновато покосился на Соболева. — я только так, для познавательности спрашиваю",0.3771185051216289,"— спросил Перепёлкин, посмотрев на Соболева, и добавил: — Мне просто так интересно",b1
"А знать я этого не могу, следовательно нельзя жить», – говорил себе Левин.",0.8449636066343015,"А знать я этого не могу, следовательно, нельзя жить, — говорил себе Левин. ",b1
"Должен признаться, наш директор хороший человек, даже очень хороший, умнейший, но у него такие взгляды… Конечно, не его дело, но все-таки, если хотите, то я, пожалуй, поговорю с ним.",0.7634034765722489,"Должен признаться, наш директор хороший человек, даже очень хороший, умнейший, но у него такие взгляды... ",b2
"Учился он один, без помощи руководителя, и притом втайне, так что мы никто этого и не подозревали. ",0.7143464533153064,"Учился он один, без помощи учителя, и притом втайне. ",b1_c1
"Жилин и говорит:  - Ну, Костылин, пойдём, попытаемся последний раз; я тебя подсажу. ",0.5423553209126553,"Жилин говорит: — Ну, Костылин, пойдём, давай попробуем в последний раз. ",a2
Чекалинский поклонился с видом того же смиренного согласия,0.8595528278501208,Чекалинский поклонился с видом того же спокойного согласия,b1
Восемнадцатилетнего прапорщика к Варе приставил Соболев. ,0.2624275363561452,"Его Варе послал Соболев, чтобы он ей помогал. ",b1
"— Нет, нет, — заговорила она, — я не боюсь его, я боюсь смерти. ",0.9836233231848596,"— Нет, — заговорила она, — я не боюсь его, я боюсь смерти. ",b1
"(На маленькое низкое дело он, впрочем, всегда готов был согласиться.) ",1.0,"(На маленькое низкое дело он, впрочем, всегда готов был согласиться.) ",b1
"Ужасно то, что нельзя вырвать с корнем прошедшего. ",0.4741684858872157,"Но я докажу ему… Ужасно то, что нельзя совсем забыть прошедшего». ",b1
"«Я должен сказать и высказать следующее: во-первых, объяснение значения общественного мнения и приличия; во-вторых, религиозное объяснение значения брака; в-третьих, если нужно, указание на могущее произойти несчастье для сына; в-четвертых, указание на ее собственное несчастье». ",0.8364974980143284,"«Во-первых, объяснение значения об щест венного мнения и приличия; во-вторых, религиозное объяс нение значения брака; в-третьих, если нужно, указание на возможное несчастье для сына; в-четвёртых, указание на её собственное несчастье». ",b1
"В Париже его просто носят на руках. — Фандорин дотронулся рукой до виска, и Варя внезапно заметила, какой у него бледный, усталый вид. — я очень торопился вернуться, но триста верст от Софии до Германлы у меня заняли больше времени, чем полторы тысячи верст от Парижа до Софии. ",0.4075793610576757,"— Я очень торопился вернуться, — продолжил он. — Но триста с небольшим километров от Софии до нашего штаба я ехал дольше, чем от Парижа до Софии, хотя между ними более полутора тысяч километров. ",b1
