source,cos_sim,target,level
"— Фортуна ко мне наконец повернулась, — просиял он. — Везенью вашего Зурова конец. ",0.1588174946247988,"Судьба встала к Зурову спиной, а ко мне лицом. ",b1
"Как скоро графиня уедет, её люди, вероятно, разойдутся, в сенях останется швейцар, но и он обыкновенно уходит в свою каморку. ",0.5593360547936125,"Как только графиня уедет, все слуги, наверное, разойдутся, при входе останется один слуга, но и он обыкновенно уходит в свою комнату. ",b1
"Он почувствовал сострадание к этой жизни, еще такой теплой и красивой, но, вероятно, уже близкой к тому, чтобы начать блекнуть и вянуть, как его жизнь. ",0.4971912672785381,"Он пожалел эту жизнь, ещё такую тёплую и красивую, но, наверное, уже близкую к тому, чтобы начать вянуть, как его жизнь. ",b1
Они дошли уже до самой выходной двери,1.0,Они дошли уже до самой выходной двери,b1
— В Мидхата-то? ,0.2881888399655669,"Он только и говорил о том, что это он сделал переворот, а не Мидхат. ",b1
"Андрей был бы хорош, только он располнел очень, это к нему не идет. ",0.928709621902347,"Андрей был бы хорош, только он располнел очень, это к нему не идёт. ",b2
"Сегодня тепло, можно окна держать настежь, а березы еще не распускались. ",0.8756815054440752,"Сегодня тепло, можно окна держать настежь, а берёзы ещё не распускались. ",b2
"— думал он. — Теперь пуля в лоб — одно остается», — и вместе с тем он сказал весёлым голосом: — Ну, еще одну карточку",0.5091274511426693,— думал Николай. — Теперь пуля в лоб — одно остаётся»,b1_c1
— И Лиза легла спать с намерением непременно исполнить веселое свое предположение.,0.2658478880359793,"— и Лиза легла спать с мыслью обязательно сделать так, как она решила. ",a2
"«Как они, как на что-то страшное, непонятное и любопытное, смотрели на меня. ",0.9999999999999996,"«Как они, как на что-то страшное, непонятное и любопытное, смотрели на меня. ",b1
Почему в Петербург? ,0.2240222923030621,У него в Петербурге есть важный родственник. ,b1
"Одно было очень неприятное — от купца, покупавшего лес в имении жены. ",0.7361355793851633,"Одно было очень неприятное — от купца, покупавшего лес, принадлежавший его жене. ",b1
"Вслед за ним пришел лакей от княгини Бетси и принес Анне записку: «Я послала к Алексею узнать об его здоровье, и он мне пишет, что здоров и цел, но в отчаянии».",0.6580456017739552,"Пришёл слуга от княгини Бетси и принёс Анне записку: «Я послала к Алексею, и он мне пишет, что здоров и цел». ",b1
"Приходится удивляться тому, как много сделал Ломоносов в области экспериментальной базисной науки, несмотря на эти неблагоприятные условия. ",0.8519017001628233,"Приходится удивляться тому, как много сделал Ломоносов в области экспериментальной базисной науки несмотря на всё это. ",b1_c1
*** Зина собирает свои книжки и мяучит. ,0.4499967580438125,"Зина собирает свои книжки, со стен снимают ковры. ",b1
"Мне часто приходила странная мысль: что, ежели бы одна воюющая сторона предложила другой — выслать из каждой армии по одному солдату? ",0.9889050575122114,Мне часто приходила странная мысль: что ежели бы одна воюющая сторона предложила другой — выслать из каждой армии по одному солдату? ,b1_b2
"Вы полагаете, мне было не жаль смельчака Зурова или добряка Маклафлина? ",0.6158341697850389,"Вы думаете, мне было не жалко смелого Зурова или доброго Маклафлина? ",b1
"Но тотчас же она отвернулась к княгине Марье Борисовне и ни разу не взглянула на него, пока он не встал, прощаясь; тут она посмотрела на него, но, очевидно, только потому, что неучтиво не смотреть на человека, когда он кланяется.",0.5405556928096531,"Но тотчас же она отошла от него и ни разу не взглянула на него, пока он не встал, прощаясь.",b1
Разговаривать долго с графом мне было некогда. ,0.2235463709924407,"Уходя, доктор Вознесенский посоветовал ему перестать пьянствовать с графом и подумать о своём здоровье. ",b1
"Однако в штабе ничего толком не знали, поскольку из ставки никаких сообщений о взятии Плевны не поступало — наоборот, выходило, что наступление отбито по всем главным пунктам и потери какие-то астрономические, не менее двадцати тысяч человек. ",0.3387860001539462,"Наоборот, говорили, что убито двадцать тысяч человек и Плевна остаётся у турок. ",b1
Больше в корчме никто в шапке не сидел. ,0.1866447391948722,Девушка почувствовала страх и ещё больше закрыла лицо шапкой. ,b1
Ты меня или не слышишь или не понимаешь?.. ,0.9497723417120932,"Ты меня или не слышишь, или не понимаешь?.. ",b1
Ведь наша контрразведка не препятствовала корреспондентам иметь в осажденном городе собственных осведомителей. ,0.2807661603937232,"Как вы знаете, наша контрразведка не запрещала журналистам встречаться в Плевне с людьми, от которых они получали информацию. ",b1
"Всё, что ты любишь, у тебя есть. ",1.0000000000000002,"Всё, что ты любишь, у тебя есть. ",b1
"Она не плакала, но была грустна, точно больна, и лицо у нее дрожало",0.2758818113494832,"Она грустно сидела и думала, и была похожа на грешницу со старой картины",b1
"И Вронскому и Анне московская жизнь в жару и пыли, когда солнце светило уже не по-весеннему, а по-летнему, и все деревья на бульварах уже давно были в листьях, и листья уже были покрыты пылью, была невыносима; но они, не переезжая в Воздвиженское, как это давно было решено, продолжали жить в опостылевшей им обоим Москве, потому что в последнее время согласия не было между ними.",0.7749457146221644,"И Вронскому, и Анне московская жизнь в жару и пыли была невыносима; но они, не переезжая в Воздвиженское, как это давно было решено, продолжали жить в надоевшей им обоим Москве, потому что в последнее время согласия не было между ними. ",b1
"- Вспомните, Иван Федорович, - сказал тревожливо и колеблясь Ганя, - что ведь она дала мне полную свободу решенья до тех самых пор, пока не решит сама дела, да и тогда все еще мое слово за мной… - Так разве ты… так разве ты… - испугался вдруг генерал",0.5090077623146191,"Ганя вдруг побледнел немного. — Вспомните, Иван Фёдорович, — сказал Ганя, — что ведьона дала мне полную свободу решения до тех самых пор, пока не решит сама дела",b1
"На другой день за завтраком Григорий Иванович спросил у дочки, всё ли намерена она спрятаться от Берестовых. ",0.7226134209401881,"На другой день за завтраком Григорий Иванович спросил у дочки, будет ли она обедать вместе с Берестовыми. ",a2
"Если шарик упадет на z?ro, то всё, что ни поставлено на столе, принадлежит банку без расчета. ",0.7920966919670545,"Если шарик упадёт на zero, то всё, что ни поставлено на столе, принадлежит банку без расчёта. ",b1_c1
"— Вам, я вижу, со мной душно, — сказал он, — кстати: не хотите ли поглядеть графа Карнеева? ",0.4866212371655373,"Кстати, не хотите ли посмотреть на графа Карнеева? ",b1
"Впрочем, не знаю; говорят, здешний климат мне будет вреден",0.9999999999999992,"Впрочем, не знаю; говорят, здешний климат мне будет вреден",b1
В это время вошла в кабинет Манилова,1.0000000000000002,В это время вошла в кабинет Манилова,b1_c1
"Дарья Александровна между тем, успокоив ребенка и по звуку кареты поняв, что он уехал, вернулась опять в спальню. ",0.8704254533087078,"Дарья Александровна между тем, успокоив ребёнка и поняв, что он уехал, вернулась опять в спальню. ",b1
"И Алексей Александрович согласился, и графиня Лидия Ивановна написала следующее французское письмо: «Милостивая государыня, Воспоминание о вас для вашего сына может повести к вопросам с его стороны, на которые нельзя отвечать, не вложив в душу ребенка духа осуждения к тому, что должно быть для него святыней, и потому прошу понять отказ вашего мужа в духе христианской любви. ",0.5357074667906793,"И Алексей Александрович согласился, и графиня Лидия Ивановна написала следующее французское письмо: «Ми""лостивая госуда""рыня! ",b1
"Она знала вперед, что всё останется по-старому и даже гораздо хуже, чем по-старому. ",0.816947815319611,"Она знала заранее, что всё останется по-старому и даже намного хуже, чем по-старому. ",b1
"— заметил я, спохватившись. — А вот что: напишите письмо",0.7500669950761197,— заметил я. — А вот что: напишите письмо,b1
Она напряглась и стала искать подходящие для разлуки слова. ,0.8410231184260712,Она стала искать подходящие для разлуки слова. ,b1_c1
"Входит Ферапонт, он в старом трепаном пальто, с поднятым воротником, уши повязаны.",0.8472600780971705,"Входит Ферапонт; он в старом трёпаном пальто, с поднятым воротником, уши повязаны.",b2
Анна переоделась в очень простое батистовое платье. ,1.0,Анна переоделась в очень простое батистовое платье. ,b1
"Из окна вагона высунулся Петя: — Варенька, пора. ",0.6426332553806766,"Из окна вагона появился Петя: — Варя, пора садиться! ",b1
"— Вы из-за того глупого молодого человека, который зебя стрелял? ",0.3180584005563969,"Вы можете описать молодого человека, который там был? ",b1
"Да и вообще военный министр вел себя так, будто он — главное лицо в правительстве, не уставая напоминать, что Абдул-Азиса сверг именно он, а вовсе не Мидхат.",0.2083124073457612,"«После переворота, — писал дальше Гнатьев, — бывший военный министр стал считать себя главным в стране. ",b1
"Он воротился влюбленный, он никогда не забывал обо мне... ",0.796301836394873,"Он вернулся влюблённый, он никогда не забывал обо мне... ",b1
"Ей, видишь, хотелось бы царить в этом обществе… Странная!",0.7248076120220776,А она бы царила в этом обществе… Странная! ,b1
Всякий пузатый мужчина напоминал ему туза. ,0.5772366655786647,Каждый мужчина с толстым животом напоминал ему туза. ,b1
"И так же, как я, делали сначала вид, что вошли случайно… по делу… Затем качали головами и, стараясь не придавать своим словам значения, заводили речь о том, как это нехорошо, когда дети растут непослушными, дерзкими и добиваются того, что их никто не любит. ",0.4480990186732855,"И так же, как я, делали сначала вид, что вошли случайно... по делу... ",b1_c1
К обеду воротился Пшехоцкий. ,0.4536416148715457,"К обеду пришёл и Пшехоцкий, но увидел Сергея, сказал, что у него болит голова, и ушёл обедать в свою комнату. ",b1
"- Захотела быть честною, так в прачки бы шла.",0.6315891971244496,"Захотела быть честной, так в пра Mчки бы шла.",b1
"Так, например, студенты математики специально занимаются только математикой, сдают они экзамены только по математике, но вместе с тем в течение всей своей жизни в университет, они не чужды и всем остальным отраслям науки. ",0.9928725065970132,"Так, например, студенты математики специально занимаются только математикой, сдают они экзамены только по математике, но вместе с тем в течение всей своей жизни в университете они не чужды и всем остальным отраслям науки. ",b1_c1
"Это гордое лицо, ужасно гордое, и вот не знаю, добра ли она? ",0.9896515082921732,"Это гордое лицо, ужасно гордое, и вот не знаю, добра ли она?",b1
"— рубил рукой воздух генерал. — Пока очухаются, город уже русский, и турки капитулировали. ",0.4001614549056713,"— продолжил генерал. — Пока они там думают, город уже будет русским! ",b1
"Алексей Александрович вздохнул и, не сказав больше ничего, отправился в спальню.",0.8843363170225919,"Алексей Александрович вздохнул и, не сказав больше ничего, пошёл в спальню. ",b1
"Но и помимо привычки, мне кажется, говорит во мне просто справедливость. ",0.9999999999999996,"Но и помимо привычки, мне кажется, говорит во мне просто справедливость. ",b2
"Но это оказалось неудобным, так как Екатерину Ивановну в ее комнате причесывал парикмахер. ",0.4825575437473225,"Но это оказалось неудобным, потому что Екатерина Ивановна была занята. ",b1
"Там она переоделась, рассеянно отвечая на вопросы нетерпеливой наперсницы, и явилась в гостиную. ",0.4907761915463869,Там она переоделась и пришла в гостиную. ,a2
"- Странная мысль, - сказал генерал",0.519030539339493,"— Странная мысль, — сказал генерал. — Смешная мысль, — сказал Тоцкий. — А хорошо получилось? ",b1
"— Скоро ж, батюшка, вернулись, — сказала Агафья Михайловна",1.0000000000000004,"— Скоро ж, батюшка, вернулись, — сказала Агафья Михайловна",b1
"Тузенбах (идет к Соленому, в руках графинчик с коньяком). ",0.871455719415131,"Тузенбах (идёт к Солёному, в руках графинчик с конья ком). ",b2
В церкви трезвонили. ,0.4224943842172762,Толпы людей шли к церкви и от церкви. ,b1
"- О, на этот счет можно без всякой церемонии, если только тебе, мой друг, угодно его видеть, - спешил разъяснить генерал. - Совершенный ребенок и даже такой жалкий; припадки у него какие-то болезненные; он сейчас из Швейцарии, только-что из вагона, одет с",0.7331701041047654,"— О, на этот раз можно без всякой церемонии, — поспешил разъяснить генерал. — Совершенный ребёнок и даже такой жалкий; припадки у него какие-то болезненные; он только что из Швейцарии, одет странно и денег ни копейки; чуть не плачет. ",b1
"Засим не пропустили председателя палаты, почтмейстера и таким образом перебрали почти всех чиновников города, которые все оказались самыми достойными людьми",0.7762551196281589,"Таким образом перебрали почти всех чиновников города, которые все оказались самыми достойными людьми",b1_c1
"Одно мне понравилось: у того клоуна, у которого сзади было нарисовано на широких штанах солнце, чуб на голове вставал и опускался… Еще ухо, я понимаю, но чуб! ",0.4614973964110749,"Мне понравилось только, что у одного клоуна сзади было нарисовано на брюках солнце, а волосы на голове сначала сами вставали, а потом падали. ",b1
"Милая, деточка моя, я знал вас со дня вашего рождения… носил на руках… я любил покойницу маму… Ирина. ",0.4468569421050084,носил на руках... я любил покойницу маму...,b2
"Но то был только дебют, далее последовал миттельшпиль.",0.294417123074341,"А потом началась центральная часть игры, миттельшпиль, как говорят шахматисты. ",b1
"Теперь же, по возвращении из Москвы, кружок этот ей стал невыносим. ",0.3319669165906957,Теперь же круг этот ей стал неприятен. ,b1
"– Нет, – перебила его графиня Лидия Ивановна. – Есть предел всему. ",0.497883787124783,"— Нет, — перебила его графиня. — Есть границы всему. ",b1
"Но стоило только приехать и пожить в Петербурге, в том кругу, в котором он вращался, где жили, именно жили, а не прозябали, как в Москве, и тотчас все мысли эти исчезали и таяли, как воск от лица огня.",0.5607108783720905,"Но стоило только приехать и пожить в Петербурге, в том кругу, где жили, а не существовали, как в Москве, он тотчас почувствовал себя опять настоящим человеком. ",b1
Услыхали наши. ,0.2837448556659462,"Услышали его казаки, поехали к нему на помощь. ",a2
"— не выдерживает Шампунь, вспыхивая. — Во Франции семейный принцип стоит очень высоко!",0.9953356637171052,"— не выдерживает Шампунь, вспыхивая. — Во Франции семейный принцип стоит очень высоко! ",b1_c1
"Я их послушался, но непонятное беспокойство овладело мною; казалось, кто-то меня так и толкал. ",0.9592340773872714,"Я послушался, но непонятное беспокойство овладело мною; казалось, кто-то меня так и толкал. ",b1_c1
"— Конечно… Даже и тогда, если муж чуть ли не в три раза старше своей супруги?",0.3562020630046191,— Даже если муж почти в 3 раза старше своей жены? ,b1
О свободе духа Ту же загадочную антиномичность можно проследить в России во всем. ,0.6644102289799213,"Ту же загадочную антиномичность можно проследить в России во всём, вскрыть много противоречий в русской душе. ",b1_c1
"– Как я рад, – сказал он, – что ты узнаешь ее. ",0.6214512131558912,"— Как я рад, — сказал он, — что ты узнаешь её. ",b1
